{
  "run_id": "drupal_ai-20260808T020222Z-205fd9",
  "schema_version": 1,
  "source_framework": "drupal_ai",
  "traces": [
    {
      "completed_at": "2026-08-08T02:09:00Z",
      "correlation_id": "drupal_ai-20260808T020222Z-205fd9:discover",
      "error": null,
      "ok": true,
      "operation": "find_images_needing_review",
      "result_sha256": "sha256:5aadbe6eb6e37abe5fefdf30deeb08f9e9bdea6725455fcfe2199feaac7c5142",
      "sequence": null,
      "started_at": "2026-08-08T02:09:00Z"
    },
    {
      "completed_at": "2026-08-08T02:09:01Z",
      "correlation_id": "drupal_ai-20260808T020222Z-205fd9:s01:context",
      "error": null,
      "ok": true,
      "operation": "get_image_context",
      "result_sha256": "sha256:457ef59dfe4ee62099fb33eda4fafbe002094a6d5e8161555148a943cc421d94",
      "sequence": 1,
      "started_at": "2026-08-08T02:09:00Z",
      "target": {
        "delta": 0,
        "existing_alt": "",
        "field_name": "field_image",
        "file_uuid": "07af2dce-7bfd-5de6-b291-e090669eda25",
        "node_uuid": "344eb273-ac74-5be8-85fb-6c2efd1f93a6",
        "revision_id": 1,
        "schema_version": 1,
        "sequence": 1,
        "target_state": "missing"
      }
    },
    {
      "completed_at": "2026-08-08T02:09:03Z",
      "correlation_id": "drupal_ai-20260808T020222Z-205fd9:s01:submit",
      "error": null,
      "ok": true,
      "operation": "submit_recommendation",
      "recommendation_uuid": "964c5baa-c22c-457d-b9a8-c7b28a966f7f",
      "result_sha256": "sha256:3931fff39f686e4692e169059c6777f94f2601688a67117e23d547ada0997cfa",
      "sequence": 1,
      "started_at": "2026-08-08T02:09:03Z",
      "target": {
        "delta": 0,
        "existing_alt": "",
        "field_name": "field_image",
        "file_uuid": "07af2dce-7bfd-5de6-b291-e090669eda25",
        "node_uuid": "344eb273-ac74-5be8-85fb-6c2efd1f93a6",
        "revision_id": 1,
        "schema_version": 1,
        "sequence": 1,
        "target_state": "missing"
      }
    },
    {
      "completed_at": "2026-08-08T02:09:04Z",
      "correlation_id": "drupal_ai-20260808T020222Z-205fd9:s01:replay",
      "error": null,
      "ok": true,
      "operation": "submit_recommendation",
      "recommendation_uuid": "964c5baa-c22c-457d-b9a8-c7b28a966f7f",
      "result_sha256": "sha256:3931fff39f686e4692e169059c6777f94f2601688a67117e23d547ada0997cfa",
      "sequence": 1,
      "started_at": "2026-08-08T02:09:03Z",
      "target": {
        "delta": 0,
        "existing_alt": "",
        "field_name": "field_image",
        "file_uuid": "07af2dce-7bfd-5de6-b291-e090669eda25",
        "node_uuid": "344eb273-ac74-5be8-85fb-6c2efd1f93a6",
        "revision_id": 1,
        "schema_version": 1,
        "sequence": 1,
        "target_state": "missing"
      }
    },
    {
      "completed_at": "2026-08-08T02:09:04Z",
      "correlation_id": "drupal_ai-20260808T020222Z-205fd9:s01:status",
      "error": null,
      "ok": true,
      "operation": "get_recommendation_status",
      "recommendation_uuid": "964c5baa-c22c-457d-b9a8-c7b28a966f7f",
      "result_sha256": "sha256:265756b6aa8fa4a1bb72f4fa68a2c32fd797ff799318a1a370bc5425efd8cdd5",
      "sequence": 1,
      "started_at": "2026-08-08T02:09:04Z",
      "target": {
        "delta": 0,
        "existing_alt": "",
        "field_name": "field_image",
        "file_uuid": "07af2dce-7bfd-5de6-b291-e090669eda25",
        "node_uuid": "344eb273-ac74-5be8-85fb-6c2efd1f93a6",
        "revision_id": 1,
        "schema_version": 1,
        "sequence": 1,
        "target_state": "missing"
      }
    },
    {
      "completed_at": "2026-08-08T02:09:04Z",
      "correlation_id": "drupal_ai-20260808T020222Z-205fd9:s02:context",
      "error": null,
      "ok": true,
      "operation": "get_image_context",
      "result_sha256": "sha256:9b6fa2df13f1b288654e02e35db5cb8c04c32439ec4ccf46d144ba6b7e8389e6",
      "sequence": 2,
      "started_at": "2026-08-08T02:09:04Z",
      "target": {
        "delta": 1,
        "existing_alt": "",
        "field_name": "field_image",
        "file_uuid": "b630423d-c3d0-5542-a5a9-418da3472af4",
        "node_uuid": "29f7a107-5567-5f64-b183-99ba0f7d2725",
        "revision_id": 2,
        "schema_version": 1,
        "sequence": 2,
        "target_state": "missing"
      }
    },
    {
      "completed_at": "2026-08-08T02:10:11Z",
      "correlation_id": "drupal_ai-20260808T020222Z-205fd9:s02:submit",
      "error": null,
      "ok": true,
      "operation": "submit_recommendation",
      "recommendation_uuid": "4c99772d-90d6-4200-a8c5-e285413a2fa2",
      "result_sha256": "sha256:7f84eb10bc5d862b32587a9863d357ff124652957f39d5dc1a76443d8d4b8cd3",
      "sequence": 2,
      "started_at": "2026-08-08T02:10:11Z",
      "target": {
        "delta": 1,
        "existing_alt": "",
        "field_name": "field_image",
        "file_uuid": "b630423d-c3d0-5542-a5a9-418da3472af4",
        "node_uuid": "29f7a107-5567-5f64-b183-99ba0f7d2725",
        "revision_id": 2,
        "schema_version": 1,
        "sequence": 2,
        "target_state": "missing"
      }
    },
    {
      "completed_at": "2026-08-08T02:10:11Z",
      "correlation_id": "drupal_ai-20260808T020222Z-205fd9:s02:replay",
      "error": null,
      "ok": true,
      "operation": "submit_recommendation",
      "recommendation_uuid": "4c99772d-90d6-4200-a8c5-e285413a2fa2",
      "result_sha256": "sha256:7f84eb10bc5d862b32587a9863d357ff124652957f39d5dc1a76443d8d4b8cd3",
      "sequence": 2,
      "started_at": "2026-08-08T02:10:11Z",
      "target": {
        "delta": 1,
        "existing_alt": "",
        "field_name": "field_image",
        "file_uuid": "b630423d-c3d0-5542-a5a9-418da3472af4",
        "node_uuid": "29f7a107-5567-5f64-b183-99ba0f7d2725",
        "revision_id": 2,
        "schema_version": 1,
        "sequence": 2,
        "target_state": "missing"
      }
    },
    {
      "completed_at": "2026-08-08T02:10:11Z",
      "correlation_id": "drupal_ai-20260808T020222Z-205fd9:s02:status",
      "error": null,
      "ok": true,
      "operation": "get_recommendation_status",
      "recommendation_uuid": "4c99772d-90d6-4200-a8c5-e285413a2fa2",
      "result_sha256": "sha256:782382bc0fed14227dd58d674190163bad524b70e2d8591d6137ebdfafa585e4",
      "sequence": 2,
      "started_at": "2026-08-08T02:10:11Z",
      "target": {
        "delta": 1,
        "existing_alt": "",
        "field_name": "field_image",
        "file_uuid": "b630423d-c3d0-5542-a5a9-418da3472af4",
        "node_uuid": "29f7a107-5567-5f64-b183-99ba0f7d2725",
        "revision_id": 2,
        "schema_version": 1,
        "sequence": 2,
        "target_state": "missing"
      }
    },
    {
      "completed_at": "2026-08-08T02:10:11Z",
      "correlation_id": "drupal_ai-20260808T020222Z-205fd9:s03:context",
      "error": null,
      "ok": true,
      "operation": "get_image_context",
      "result_sha256": "sha256:a3cd645f2a57a3fbccc6778baeac379c45ff723acbd1d2bbe834d351fc54173b",
      "sequence": 3,
      "started_at": "2026-08-08T02:10:11Z",
      "target": {
        "delta": 0,
        "existing_alt": "",
        "field_name": "field_image",
        "file_uuid": "e5beebf7-66d1-5f7c-aa1f-899721995bb3",
        "node_uuid": "016f6faa-c1e9-56e2-885f-696d733e52ad",
        "revision_id": 3,
        "schema_version": 1,
        "sequence": 3,
        "target_state": "missing"
      }
    },
    {
      "completed_at": "2026-08-08T02:11:19Z",
      "correlation_id": "drupal_ai-20260808T020222Z-205fd9:s03:submit",
      "error": null,
      "ok": true,
      "operation": "submit_recommendation",
      "recommendation_uuid": "720102f0-54bc-4828-b71d-3a297d67cd6b",
      "result_sha256": "sha256:a1fc517d81193554829071bc332940a2c1a990c5c77352a2179d401b96417685",
      "sequence": 3,
      "started_at": "2026-08-08T02:11:19Z",
      "target": {
        "delta": 0,
        "existing_alt": "",
        "field_name": "field_image",
        "file_uuid": "e5beebf7-66d1-5f7c-aa1f-899721995bb3",
        "node_uuid": "016f6faa-c1e9-56e2-885f-696d733e52ad",
        "revision_id": 3,
        "schema_version": 1,
        "sequence": 3,
        "target_state": "missing"
      }
    },
    {
      "completed_at": "2026-08-08T02:11:19Z",
      "correlation_id": "drupal_ai-20260808T020222Z-205fd9:s03:replay",
      "error": null,
      "ok": true,
      "operation": "submit_recommendation",
      "recommendation_uuid": "720102f0-54bc-4828-b71d-3a297d67cd6b",
      "result_sha256": "sha256:a1fc517d81193554829071bc332940a2c1a990c5c77352a2179d401b96417685",
      "sequence": 3,
      "started_at": "2026-08-08T02:11:19Z",
      "target": {
        "delta": 0,
        "existing_alt": "",
        "field_name": "field_image",
        "file_uuid": "e5beebf7-66d1-5f7c-aa1f-899721995bb3",
        "node_uuid": "016f6faa-c1e9-56e2-885f-696d733e52ad",
        "revision_id": 3,
        "schema_version": 1,
        "sequence": 3,
        "target_state": "missing"
      }
    },
    {
      "completed_at": "2026-08-08T02:11:19Z",
      "correlation_id": "drupal_ai-20260808T020222Z-205fd9:s03:status",
      "error": null,
      "ok": true,
      "operation": "get_recommendation_status",
      "recommendation_uuid": "720102f0-54bc-4828-b71d-3a297d67cd6b",
      "result_sha256": "sha256:b626e2775792e667d9875a196652bd1add27a5e0468bca1cca309b4ccc948f63",
      "sequence": 3,
      "started_at": "2026-08-08T02:11:19Z",
      "target": {
        "delta": 0,
        "existing_alt": "",
        "field_name": "field_image",
        "file_uuid": "e5beebf7-66d1-5f7c-aa1f-899721995bb3",
        "node_uuid": "016f6faa-c1e9-56e2-885f-696d733e52ad",
        "revision_id": 3,
        "schema_version": 1,
        "sequence": 3,
        "target_state": "missing"
      }
    },
    {
      "completed_at": "2026-08-08T02:11:19Z",
      "correlation_id": "drupal_ai-20260808T020222Z-205fd9:s04:context",
      "error": null,
      "ok": true,
      "operation": "get_image_context",